{"schema":"rhythm-soundcheck/v1+jsonl","kind":"run","tool":"rhythm-soundcheck","version":"1.2.2","target":"http://localhost:18810/a11y/legacy.php","name":"good","started":"2026-10-26T04:37:19.102728717Z","duration_ms":3737,"options":{"viewports":["desktop","mobile"],"levels":["inspect","click"],"modules":["health","a11y"],"limit":20},"pages":[],"skipped":{"not included":3},"warnings":[],"pages_file":"pages.jsonl","page_count":1}