{"schema":"rhythm-soundcheck/v1+jsonl","kind":"run","tool":"rhythm-soundcheck","version":"1.2.2","target":"http://brew.test/","started":"2026-10-23T09:00:00Z","duration_ms":61000,"options":{"viewports":["desktop"],"levels":null,"modules":["health","visual","interact","cache","speed","a11y"],"limit":0},"pages":[],"warnings":["robots.txt couldn't be read"],"pages_file":"pages.jsonl","page_count":2}